{
  "schema_version": "2.0",
  "suite_id": "tool-construction-xrd-ftir-v1",
  "description": "Hidden-oracle construction, published-tool selection and bounded repair cases.",
  "defaults": {"service_access": {"jev_like": false, "llm": false}, "repair_budget": 2, "isolation_backend": "docker"},
  "cases": [
    {"case_id": "TC01_hidden_xrd", "kind": "tool_construction", "prompt": "构造一个可复用的 XRD 寻峰和主相识别工具。", "tool_visibility": "hidden_reference", "fixture": {"generator": "generate_analysis_fixtures", "seed": 20260930, "seeds": [20261001, 20261002], "path": "examples/data/configured_analysis/xrd/xrd_20260930.csv", "noise_profile": {"poisson": true, "zero_shift_deg": 0.03, "sparse_spikes": 2}, "ground_truth": {"dominant_phase": "anatase_tio2", "main_peak_deg": 25.3}}, "service_access": {"jev_like": false, "llm": true}, "expected": {"proposal_status": "draft", "reference_not_exposed": true, "main_peak_tolerance": 0.15, "minimum_matched_peaks": 5, "requires_human_review": true}},
    {"case_id": "TC02_hidden_ftir", "kind": "tool_construction", "prompt": "构造一个可复用的 FTIR 寻峰和保守官能团指认工具。", "tool_visibility": "hidden_reference", "fixture": {"generator": "generate_analysis_fixtures", "seed": 20260930, "seeds": [20261001, 20261002], "path": "examples/data/configured_analysis/ftir/ftir_20260930.csv", "noise_profile": {"gaussian_sigma_au": [0.003, 0.008], "axis_shift_cm-1": 2, "sparse_outliers": 2}, "ground_truth": {"main_peak_cm-1": 1710, "assignment": "carbonyl_candidate"}}, "service_access": {"jev_like": false, "llm": true}, "expected": {"proposal_status": "draft", "reference_not_exposed": true, "main_peak_tolerance": 8, "required_assignment": "carbonyl_candidate", "requires_human_review": true}},
    {"case_id": "TS01_published_xrd", "kind": "tool_selection", "prompt": "识别这份 XRD 的主要晶相。", "tool_visibility": "published_reference", "fixture": {"path": "examples/data/configured_analysis/xrd/xrd_20260930.csv", "seed": 20260930}, "service_access": {"jev_like": true, "llm": true}, "expected": {"selected_tool": "reference_xrd_phase_identification", "construct_duplicate": false}},
    {"case_id": "TS02_published_ftir", "kind": "tool_selection", "prompt": "找出这份 FTIR 的主要峰并给出官能团候选。", "tool_visibility": "published_reference", "fixture": {"path": "examples/data/configured_analysis/ftir/ftir_20260930.csv", "seed": 20260930}, "service_access": {"jev_like": true, "llm": true}, "expected": {"selected_tool": "reference_ftir_functional_group_assignment", "construct_duplicate": false}},
    {"case_id": "TR01_column_alias_repair", "kind": "tool_repair", "prompt": "修复生成工具，使其支持合法的列别名。", "tool_visibility": "hidden_reference", "fixture": {"path": "examples/data/configured_analysis/xrd/xrd_20261001.csv", "seed": 20261001}, "parameters": {"defect": "wrong_column_mapping"}, "service_access": {"jev_like": false, "llm": true}, "expected": {"max_repairs": 2, "proposal_must_change": true, "holdout_must_pass": true}},
    {"case_id": "TR02_peak_range_repair", "kind": "tool_repair", "prompt": "修复过窄的 FTIR 峰搜索范围并重新验证。", "tool_visibility": "hidden_reference", "fixture": {"path": "examples/data/configured_analysis/ftir/ftir_20261001.csv", "seed": 20261001}, "parameters": {"defect": "narrow_peak_range"}, "service_access": {"jev_like": false, "llm": true}, "expected": {"max_repairs": 2, "proposal_must_change": true, "holdout_must_pass": true}},
    {"case_id": "TR03_unsupported_step_rebuild", "kind": "tool_repair", "prompt": "当前配方包含不支持的步骤，请修订或重新构造。", "tool_visibility": "hidden_reference", "fixture": {"path": "examples/data/configured_analysis/xrd/xrd_20261002.csv", "seed": 20261002}, "parameters": {"defect": "unsupported_operation", "code_fallback_backend": "docker"}, "service_access": {"jev_like": false, "llm": true}, "expected": {"max_repairs": 2, "proposal_must_change": true, "prefer_recipe_repair": true}},
    {"case_id": "TR04_overfit_repair", "kind": "tool_repair", "prompt": "工具只适用于固定行数和顺序，请提高泛化性。", "tool_visibility": "hidden_reference", "fixture": {"paths": ["examples/data/configured_analysis/ftir/ftir_20261001.csv", "examples/data/configured_analysis/ftir/ftir_20261002.csv"], "seeds": [20261001, 20261002]}, "parameters": {"defect": "fixed_shape_overfit", "metamorphic_checks": ["row_order", "intensity_scaling", "column_alias"]}, "service_access": {"jev_like": false, "llm": true}, "expected": {"max_repairs": 2, "proposal_must_change": true, "holdout_must_pass": true}},
    {"case_id": "TS03_optional_ebrick_xrd", "kind": "tool_selection", "prompt": "读取并提取 EBrick 样品 XRD 的主要峰；没有参考物相库时不要伪造物相结论。", "tool_visibility": "published_reference", "fixture": {"optional_external_path": "D:/Researches/EBrick/data-raw/XRD/18602921WQS-4XRD", "ground_truth": {"sample_ids": ["3", "4", "9", "10"], "stage": "球磨并干燥后、1200℃煅烧之前"}}, "service_access": {"jev_like": false, "llm": false}, "expected": {"structured_peaks": true, "no_fabricated_phase": true, "skip_if_missing": true}}
  ]
}
